<xsd:schema
        xmlns:xsd="http://www.w3.org/2001/XMLSchema">

    <xsd:simpleType name="INTEGER">
        <xsd:restriction base="xsd:int">
            <xsd:maxInclusive value="2147483647"/>
            <xsd:minInclusive value="-2147483648"/>
        </xsd:restriction>
    </xsd:simpleType>

    <xsd:simpleType name="VARCHAR">
        <xsd:restriction base="xsd:string">
        </xsd:restriction>
    </xsd:simpleType>

    <xsd:complexType name="RowType.Miacd.public.driver">
        <xsd:sequence>
            <xsd:element name="first_name" type="VARCHAR" nillable="false"></xsd:element>
            <xsd:element name="second_name" type="VARCHAR" nillable="false"></xsd:element>
            <xsd:element name="contact_num" type="VARCHAR" nillable="false"></xsd:element>
        </xsd:sequence>
        <xsd:attribute name="id" type="INTEGER" use="required"/>
    </xsd:complexType>

    <xsd:complexType name="drivers">
        <xsd:sequence minOccurs="1" maxOccurs="unbounded">
            <xsd:element name="driver" type="RowType.Miacd.public.driver"></xsd:element>
        </xsd:sequence>
    </xsd:complexType>

    <xsd:element name="drivers" type="drivers"/>

</xsd:schema>